<?xml version="1.0" encoding="UTF-8"?>
<!DOCTYPE world SYSTEM "parcours.dtd">
<world>
	<description>Hier wohnen die Testbots des c't-Sim! TCP-Bots duerfen aber auch mal reinschauen. ;-)</description>
	<parcours>
<line>*============================*</line>
<line>#                            #</line>
<line>#                            #</line>
<line>#     #    #      #    #     #</line>
<line>#  ===#    #      #    #     #</line>
<line>#          #      #          #</line>
<line>#                            #</line>
<line>#                            #</line>
<line>#   =====#  =====   #=====   #</line>
<line>#   1    #          #    #   #</line>
<line>#        #          #        #</line>
<line>#        #   #0  #  #    2   #</line>
<line>*============================*</line>
	</parcours>
	<optics>
		<appearance type="X">
			<description>quadratische Wand</description>
			<texture>textures/rock_wall.jpg</texture>
			<color>#999999</color>
		</appearance>
		<appearance type="#">
			<description>senkrechte Wand</description>
			<clone>X</clone>
		</appearance>
		<appearance type="=">
			<description>wagrechte Wand</description>
			<clone>X</clone>
		</appearance>
		<appearance type=" ">
			<description>Fussboden im Labyrinth</description>
			<color type="ambient">#606060</color>
			<color type="diffuse">#606060</color>
		</appearance>
		<appearance type="L">
			<description>Fussboden mit Loch</description>
			<color type="ambient">#000000</color>
			<color type="diffuse">#000000</color>
		</appearance>
		<appearance type="1">
			<description>Fussboden des Startfeldes 1</description>
			<color type="ambient">#993030</color>
			<color type="diffuse">#993030</color>
		</appearance>
		<appearance type="2">
			<description>Fussboden des Startfeldes 2</description>
			<color type="ambient">#000099</color>
			<color type="diffuse">#000099</color>
		</appearance>
		<appearance type="0">
			<description>Fussboden des Default-Startfeldes</description>
			<color type="ambient">#FFFFFF</color>
			<color type="diffuse">#FFFFFF</color>
		</appearance>
		<appearance type="*"><description>Lichtkugel</description>
			<color type="emmissive">#FFFF90</color>
		</appearance>
	</optics>
</world>
