<?xml version="1.0" encoding="UTF-8" standalone="yes"?>
<!DOCTYPE collection SYSTEM "parcours.dtd">

<world>
	<description>
		Dieses ist ein Linien-Testparcours fuer bot_follow_line_enhanced()
	</description>
		
	<parcours>
		
		<line>===========</line>
		<line>#*       *#</line>
		<line>#    |    #</line>
		<line>#    |    #</line>
		<line>#    #    #</line>
		<line>#    |    #</line>
		<line>#    |    #</line>
		<line>#*   .   *#</line>
		<line>=====1=====</line>
	</parcours>

	<optics>
		<appearance type="X">
			<description>quadratische Wand</description>
			<texture>textures/rock_wall.jpg</texture>
			<color>#999999</color>
		</appearance>
		<appearance type="#">
			<description>senkrechte Wand</description>
			<clone>X</clone>
		</appearance>
		<appearance type="=">
			<description>wagrechte Wand</description>
			<clone>X</clone>
		</appearance>

		
		<appearance type="."> 
			<description>Fussboden im Eingangsbereich</description>
			<color type="ambient">#FFFFFF</color>
			<color type="diffuse">#CCFFFF</color>
		</appearance>
		
		<appearance type=" "> 
			<description>Fussboden im Labyrinth</description>
			<color type="ambient">#606060</color>
			<color type="diffuse">#CCFFFF</color>
		</appearance>
		
		<appearance type="1"> 
			<description>Fussboden des Startfeldes 1</description>
			<color type="ambient">#993030</color>
			<color type="diffuse">#993030</color>
		</appearance>
		
		<appearance type="Z"> 
			<description>Fussboden des Zielfeldes 0</description>
			<color type="ambient">#66FF00</color>
			<color type="diffuse">#66FF00</color>
		</appearance>
	
		<appearance type="*"> 
			<description>Lichtkugel</description>
			<color type="emmissive">#FFFF90</color>
		</appearance>
		
		<appearance type="-"> 
			<description>Linie</description>
			<color type="ambient">#000000</color>
			<color type="diffuse">#000000</color>
			<color type="specular">#000000</color>
			<color type="emmissive">#000000</color>
		</appearance>

		<appearance type="|"> 
			<description>Linie</description>
			<clone>-</clone>
		</appearance>

		<appearance type="/"> 
			<description>Linie</description>
			<clone>-</clone>
		</appearance>

		<appearance type="+"> 
			<description>Linie</description>
			<clone>-</clone>
		</appearance>
		
		<appearance type="["> 
			<description>Linie</description>
			<clone>-</clone>
		</appearance>
				
	</optics>


</world>